{"agent_id":"450999ca-ae2a-409c-8a26-d00a71132440","argv":["/usr/local/bin/node","/app/src/index.mjs"],"backend":{"api_contract":"dashboard-session-activity/v1","url":"http://127.0.0.1:3000"},"cleanup":{"ollama_model_unloaded":true,"registry_container_absent":true,"registry_container_removed":true,"registry_tag_removed":true,"registry_volume_absent":true,"registry_volume_removed":true,"sandbox_absent":true,"sandbox_delete_attempted":true},"collection_window":{"deadline":"2026-09-15T14:26:54.068962Z","started_at":"2026-09-15T14:25:54.068962Z"},"command_exit_code":0,"completed_at":"2026-08-26T11:15:45.875976Z","core":{"authorization_class":"openbox_runtime_key","evaluation_governance_events":6,"last_validation_status":200,"matching_agent_validations":1,"validation_attempts":1,"validation_successes":1},"coverage_limitations":["development observation only; not a production confinement or enforcement qualification","Core relay credential use is bound to the validated OCI entrypoint executable","landlock best_effort may run without filesystem enforcement","runtime cgroup pids.max availability is not guaranteed","OpenBox evaluation agent uses provider-bound bearer authentication without SDK request signing"],"duration_ms":20563,"effects":{"safe_sink_attempts":1,"safe_sink_matching":1},"environment_names":["NODE_ENV","NODE_VERSION","OPENAI_API_KEY","OPENAI_BASE_URL","OPENAI_MODEL","OPENBOX_AGENT_ID","OPENBOX_API_KEY","OPENBOX_EVALUATION_ID","OPENBOX_SAFE_SINK_URL","OPENBOX_URL","PATH"],"evaluation_id":"ev-656213e0d3ddc7400f324769","exit_classification":"success","image":{"immutable_reference":"sha256:e13c1e89b1daa897f319402d1b0642c329f471c663665142e05aa3fc6f110dc6","local_id":"sha256:e13c1e89b1daa897f319402d1b0642c329f471c663665142e05aa3fc6f110dc6","manifest_digest":"sha256:ee07679462d1f4432cb154d4cb90e06285d83558010a5096ce15627d79f38bf7","platform":"linux/arm64","published_reference":"127.0.0.1:52706/ai.openbox/evaluation@sha256:ee07679462d1f4432cb154d4cb90e06285d83558010a5096ce15627d79f38bf7","requested":"ai.openbox/mastra-conformance:local","working_dir":"/app"},"inference":{"model":"granite4.1:3b","model_digest":"sha256:6fd349357287c7ffc9e38189a93b48ea175d24fc566b38f09cfc564fb7f303eb","provider":"openai-compatible-provider"},"logs":{"process_stderr":{"bytes":289,"sha256":"sha256:2733c24680876144ed8cf538a1a964f33a9bb7448a4431c05704f4e5e915b892","truncated":false},"process_stdout":{"bytes":844,"sha256":"sha256:dfcb416eaac13fbacec364ea13bf6864d51a0900ab9cd5360e031263bdc88721","truncated":false},"sandbox_evidence":{"bytes":0,"sha256":"sha256:0000000000000000000000000000000000000000000000000000000000000000","truncated":false}},"organization_id":"openbox.ai","phases":[{"at":"2026-08-26T11:15:25.31299Z","phase":"preflighted"},{"at":"2026-08-26T11:15:25.31299Z","phase":"output_created"},{"at":"2026-08-26T11:15:25.367563Z","phase":"backend_preflighted"},{"at":"2026-08-26T11:15:29.879336Z","phase":"model_loaded"},{"at":"2026-08-26T11:15:30.118182Z","phase":"registry_started"},{"at":"2026-08-26T11:15:35.871082Z","phase":"image_published"},{"at":"2026-08-26T11:15:35.871306Z","phase":"core_relay_started"},{"at":"2026-08-26T11:15:35.871338Z","phase":"safe_effect_sink_started"},{"at":"2026-08-26T11:15:35.88704Z","phase":"sandbox_creating"},{"at":"2026-08-26T11:15:38.776422Z","phase":"ready"},{"at":"2026-08-26T11:15:45.058151Z","phase":"command_exited"},{"at":"2026-08-26T11:15:45.058162Z","phase":"logs_captured"},{"at":"2026-08-26T11:15:45.249805Z","phase":"sandbox_deleted"},{"at":"2026-08-26T11:15:45.541267Z","phase":"registry_removed"},{"at":"2026-08-26T11:15:45.875974Z","phase":"execution_recorded"}],"sandbox":{"capability":"project_run_v2","provider":"obx-openbox-local","service":"openbox-sandbox"},"schema":"ai.openbox.project-observation.run/v2","selected_session_id":"4a794d05-076c-4dc6-add4-0615f1af6e80","started_at":"2026-08-26T11:15:25.312969Z"}